{
  "id": "adonalsium-investiture",
  "name": "Adonalsium's Investiture",
  "summary": "The primeval investiture of Adonalsium before the Shattering. Its true nature and capabilities remain unknown.",
  "planet": "yolen",
  "shard": "Adonalsium",
  "category": "primordial",
  "color": "#a78bfa",
  "books": [],
  "classification": "Primordial",
  "status": "Theoretical",
  "academicNote": "No reliable documentation exists for the period before the Shattering.",
  "allomanticMetals": []
}
